{
  "schema_version": 2,
  "book_id": "restaurant-of-many-orders",
  "source_revision": 1,
  "source_sha256": "d6a87bc6b7105fb921afa0cd154d8428dfe4461773651c4a4ae803c0b093a5f1",
  "scenes": [
    {
      "id": "scene_001",
      "label": "深山",
      "start": "p0002",
      "end": "p0020",
      "location": "mountain_forest",
      "time": "dusk",
      "weather": "windy",
      "mood": ["arrogant", "isolated", "uneasy"],
      "tension": 0.22,
      "background": {
        "tags": ["mountain", "forest", "autumn", "dusk"]
      },
      "music": {
        "tags": ["minimal", "uneasy", "distant"],
        "intensity": 0.18
      },
      "ambience": {
        "tags": ["mountain_wind", "dry_leaves"]
      },
      "grade": "dusk",
      "shots": [
        {
          "at": "p0002",
          "framing": "wide",
          "move": "drift"
        },
        {
          "at": "p0014",
          "framing": "medium",
          "move": "push_in",
          "focus": "path"
        }
      ]
    },
    {
      "id": "scene_002",
      "label": "山猫轩",
      "start": "p0021",
      "end": "p0037",
      "location": "wildcat_restaurant_exterior",
      "time": "dusk",
      "weather": "windy",
      "mood": ["relieved", "curious", "deceptive_warmth"],
      "tension": 0.28,
      "background": {
        "tags": ["restaurant", "mountain", "warm_light", "mysterious"]
      },
      "music": {
        "tags": ["polite", "uncanny", "minimal"],
        "intensity": 0.24
      },
      "ambience": {
        "tags": ["mountain_wind"]
      },
      "grade": "dusk",
      "shots": [
        {
          "at": "p0021",
          "framing": "wide",
          "move": "push_in",
          "focus": "entrance"
        }
      ]
    },
    {
      "id": "scene_003",
      "label": "蓝色的门",
      "start": "p0038",
      "end": "p0050",
      "location": "wildcat_restaurant_corridor",
      "time": "night",
      "weather": null,
      "mood": ["amused", "curious", "subtly_wrong"],
      "tension": 0.34,
      "background": {
        "tags": ["corridor", "blue_doors", "warm_lamps", "empty"]
      },
      "music": {
        "tags": ["uncanny", "minimal", "polite"],
        "intensity": 0.3
      },
      "ambience": {
        "tags": ["empty_room", "distant_wind"]
      },
      "grade": "lamplight",
      "shots": [
        {
          "at": "p0038",
          "framing": "medium",
          "move": "hold",
          "focus": "far_door"
        }
      ]
    },
    {
      "id": "scene_004",
      "label": "接连的要求",
      "start": "p0051",
      "end": "p0078",
      "location": "wildcat_restaurant_corridor",
      "time": "night",
      "weather": null,
      "mood": ["compliant", "confused", "uneasy"],
      "tension": 0.48,
      "background": {
        "tags": ["corridor", "successive_doors", "empty", "uncanny"]
      },
      "music": {
        "tags": ["uncanny", "repetitive", "minimal"],
        "intensity": 0.4
      },
      "ambience": {
        "tags": ["empty_room", "door_hum"]
      },
      "grade": "lamplight",
      "shots": [
        {
          "at": "p0051",
          "framing": "medium",
          "move": "push_in",
          "focus": "far_door"
        }
      ]
    },
    {
      "id": "scene_005",
      "label": "最后一项",
      "start": "p0079",
      "end": "p0112",
      "location": "wildcat_restaurant_preparation_room",
      "time": "night",
      "weather": null,
      "mood": ["absurd", "suspicious", "terrified"],
      "tension": 0.72,
      "background": {
        "tags": ["mirror", "cream", "salt", "preparation_room"]
      },
      "music": {
        "tags": ["realization", "dread", "low_drone"],
        "intensity": 0.7
      },
      "ambience": {
        "tags": ["empty_room", "low_hum"]
      },
      "grade": "unease",
      "shots": [
        {
          "at": "p0079",
          "framing": "wide",
          "move": "drift"
        },
        {
          "at": "p0104",
          "framing": "medium",
          "move": "push_in",
          "focus": "door"
        }
      ]
    },
    {
      "id": "scene_006",
      "label": "钥匙孔",
      "start": "p0113",
      "end": "p0136",
      "location": "wildcat_restaurant_final_door",
      "time": "night",
      "weather": null,
      "mood": ["trapped", "terrified", "predatory"],
      "tension": 0.98,
      "background": {
        "tags": ["final_door", "keyholes", "dark_hall", "claustrophobic"]
      },
      "music": {
        "tags": ["tension_high", "dread", "low_drone"],
        "intensity": 0.95
      },
      "ambience": {
        "tags": ["empty_room", "muffled_voices"]
      },
      "grade": "dread",
      "shots": [
        {
          "at": "p0113",
          "framing": "medium",
          "move": "hold",
          "focus": "door_gap"
        },
        {
          "at": "p0119",
          "framing": "medium",
          "move": "push_in",
          "focus": "door_gap"
        },
        {
          "at": "p0134",
          "framing": "wide",
          "move": "pull_out"
        }
      ]
    },
    {
      "id": "scene_007",
      "label": "雾散之后",
      "start": "p0137",
      "end": "p0149",
      "location": "mountain_forest",
      "time": "dawn",
      "weather": "misty",
      "mood": ["released", "exhausted", "uncanny_aftertaste"],
      "tension": 0.12,
      "background": {
        "tags": ["mountain", "forest", "mist", "dawn"]
      },
      "music": {
        "tags": ["minimal", "quiet", "aftermath"],
        "intensity": 0.14
      },
      "ambience": {
        "tags": ["mountain_wind", "wet_leaves"]
      },
      "grade": "dawn",
      "shots": [
        {
          "at": "p0137",
          "framing": "wide",
          "move": "pull_out",
          "focus": "valley"
        }
      ]
    }
  ],
  "grades": {
    "dusk": {
      "tint": "#d9b98a",
      "shade": 0.12,
      "saturation": 1.0
    },
    "lamplight": {
      "tint": "#e0c49a",
      "shade": 0.1,
      "saturation": 0.95
    },
    "unease": {
      "tint": "#9aa89a",
      "shade": 0.18,
      "saturation": 0.8
    },
    "dread": {
      "tint": "#55627a",
      "shade": 0.32,
      "saturation": 0.6
    },
    "dawn": {
      "tint": "#c8ccd2",
      "shade": 0.08,
      "saturation": 0.7
    }
  },
  "moments": [
    {
      "id": "moment_001",
      "at": "p0042",
      "template": "letterbox_hold",
      "intent": "threshold",
      "hold_ms": 1200
    },
    {
      "id": "moment_002",
      "at": "p0118",
      "template": "isolate_line",
      "intent": "threat",
      "hold_ms": 1800
    }
  ]
}
