{
  "schema_version": 1,
  "book_id": "fixture-book",
  "source_revision": 1,
  "source_sha256": "3978aa0746fa60df7511af9781d665fbf2411a341ce383d7e79d2933c6c70b21",
  "scenes": [
    {
      "id": "scene_001",
      "start": "p0002",
      "end": "p0003",
      "location": "mountain_forest",
      "time": "night",
      "weather": "rain",
      "mood": ["quiet", "uneasy"],
      "tension": 0.25,
      "background": {
        "tags": ["forest", "night", "rain"]
      },
      "music": {
        "tags": ["minimal", "quiet"],
        "intensity": 0.2
      },
      "ambience": {
        "tags": ["light_rain"]
      }
    },
    {
      "id": "scene_002",
      "start": "p0004",
      "end": "p0004",
      "location": "distant_city",
      "time": "night",
      "weather": "rain",
      "mood": ["hopeful"],
      "tension": 0.15,
      "background": {
        "tags": ["city", "lights", "night"]
      },
      "music": {
        "tags": ["minimal", "quiet"],
        "intensity": 0.15
      },
      "ambience": {
        "tags": ["light_rain"]
      }
    }
  ]
}
